<?xml version="1.0" encoding="UTF-8"?>
<metadata xmlns="http://maven.apache.org/maven-metadata/2.0.0" 
             xmlns:xsi="http://www.w3.org/2001/XMLSchema-instance" 
             xsi:schemaLocation="http://maven.apache.org/maven-metadata/2.0.0 maven-metadata-v2_0_0.xsd">
  <groupId>com.infopaq.env</groupId>
  <artifactId>environment</artifactId>
  <versioning>
    <latest>1.2.0-SNAPSHOT</latest>
    <versions>
      <version>1.2.0-SNAPSHOT</version>
    </versions>
    <lastUpdated>20110808120607</lastUpdated>
  </versioning>
</metadata>